{
  "$schema": "https://json-schema.org/draft/2020-12/schema",
  "$id": "https://vxsan.com/schemas/finance-browser-capture-v1.json",
  "title": "Finance browser capture",
  "type": "object",
  "additionalProperties": false,
  "required": ["schema_version", "capture_id", "source", "artifact", "account"],
  "properties": {
    "schema_version": {"const": 1},
    "capture_id": {"type": "string", "minLength": 1},
    "approval": {
      "type": "object",
      "additionalProperties": false,
      "required": ["status", "scope", "capture_id", "approved_by", "approved_at"],
      "properties": {
        "status": {"const": "OWNER_APPROVED"},
        "scope": {"const": "ALL_VISIBLE_ROWS"},
        "capture_id": {"type": "string", "minLength": 1},
        "approved_by": {"const": "OWNER"},
        "approved_at": {"type": "string", "format": "date-time"}
      }
    },
    "source": {
      "type": "object",
      "additionalProperties": false,
      "required": ["provider", "captured_at", "capture_method"],
      "properties": {
        "provider": {"type": "string", "minLength": 1},
        "site": {"type": "string"},
        "url": {"type": "string", "format": "uri"},
        "page_context": {"type": "string"},
        "captured_at": {"type": "string", "format": "date-time"},
        "capture_method": {
          "enum": ["ACCOUNT_OVERVIEW", "OFFICIAL_EXPORT", "STATEMENT_DOWNLOAD", "VISIBLE_ROWS"]
        },
        "date_range": {
          "type": "object",
          "additionalProperties": false,
          "properties": {
            "start": {"type": "string", "format": "date"},
            "end": {"type": "string", "format": "date"}
          }
        },
        "limitations": {"type": "array", "items": {"type": "string"}}
      }
    },
    "artifact": {
      "type": "object",
      "additionalProperties": false,
      "required": ["kind"],
      "properties": {
        "kind": {
          "enum": ["ACCOUNT_SNAPSHOT", "STATEMENT_PDF", "STATEMENT_ROWS", "TRANSACTION_ROWS"]
        },
        "local_path": {"type": "string"},
        "file_name": {"type": "string"},
        "mime_type": {"type": "string"},
        "download_reference": {"type": "string"}
      }
    },
    "account": {
      "type": "object",
      "additionalProperties": false,
      "required": ["label"],
      "properties": {
        "label": {"type": "string", "minLength": 1},
        "actual_account": {"type": "string"},
        "card_code": {"type": "string"},
        "account_last4": {"type": "string", "pattern": "^[0-9]{4}$"},
        "currency": {"type": "string", "pattern": "^[A-Za-z]{3}$"},
        "balance": {"type": ["string", "number"]},
        "available_balance": {"type": ["string", "number"]},
        "balance_as_of": {"type": "string", "format": "date-time"}
      }
    },
    "statement": {
      "type": "object",
      "additionalProperties": false,
      "properties": {
        "statement_reference": {"type": "string"},
        "period_start": {"type": "string", "format": "date"},
        "period_end": {"type": "string", "format": "date"},
        "payment_due_date": {"type": "string", "format": "date"},
        "opening_balance_aed": {"type": ["string", "number"]},
        "closing_balance_aed": {"type": ["string", "number"]},
        "balance_convention": {"enum": ["ASSET", "LIABILITY"]}
      }
    },
    "rows": {
      "type": "array",
      "items": {
        "type": "object",
        "additionalProperties": false,
        "required": ["transaction_date", "description", "amount_aed", "direction"],
        "properties": {
          "source_id": {"type": "string"},
          "reference": {"type": "string"},
          "transaction_date": {"type": "string", "format": "date"},
          "post_date": {"type": "string", "format": "date"},
          "description": {"type": "string", "minLength": 1},
          "amount_aed": {"type": ["string", "number"]},
          "amount_original": {"type": ["string", "number"]},
          "currency": {"type": "string", "pattern": "^[A-Za-z]{3}$"},
          "direction": {"enum": ["DEBIT", "CREDIT"]},
          "transaction_type": {"type": "string"},
          "channel": {"type": "string"},
          "account_last4": {"type": "string", "pattern": "^[0-9]{4}$"},
          "card_role": {"enum": ["primary", "supplementary"]},
          "status": {"type": "string"},
          "review_required": {"type": "boolean"}
        }
      }
    }
  }
}
